Database changed
mysql> SELECT * from animals where name like '%mon';
+----+---------+---------------+-----------------+----------+-----------+
| id | name    | date_of_birth | escape_attempts | neutered | weight_kg |
+----+---------+---------------+-----------------+----------+-----------+
|  1 | Agumon  | 2020-02-03    |               0 |        1 |     10.23 |
|  2 | Gabumon | 2018-11-15    |               2 |        1 |      8.00 |
|  4 | Devimon | 2017-05-12    |               5 |        1 |     11.00 |
+----+---------+---------------+-----------------+----------+-----------+
3 rows in set (0.00 sec)

mysql> SELECT name from animals where date_of_birth
    -> between '2016-01-01' and '2019-12-31';
+---------+
| name    |
+---------+
| Gabumon |
| Devimon |
+---------+
2 rows in set (0.00 sec)

mysql> SELECT name from animals where neutered = true and escape_attempts < 3;
+---------+
| name    |
+---------+
| Agumon  |
| Gabumon |
+---------+
2 rows in set (0.00 sec)

mysql> SELECT date_of_birth from animals where name in ("Agumon","Pikachu");
+---------------+
| date_of_birth |
+---------------+
| 2020-02-03    |
| 2021-01-07    |
+---------------+
2 rows in set (0.00 sec)

mysql> select name,escape_attempts from animals where weight_kg > 10.5;
+---------+-----------------+
| name    | escape_attempts |
+---------+-----------------+
| Pikachu |               1 |
| Devimon |               5 |
+---------+-----------------+
2 rows in set (0.00 sec)

mysql> select * from animals where neutered = true;
+----+---------+---------------+-----------------+----------+-----------+
| id | name    | date_of_birth | escape_attempts | neutered | weight_kg |
+----+---------+---------------+-----------------+----------+-----------+
|  1 | Agumon  | 2020-02-03    |               0 |        1 |     10.23 |
|  2 | Gabumon | 2018-11-15    |               2 |        1 |      8.00 |
|  4 | Devimon | 2017-05-12    |               5 |        1 |     11.00 |
+----+---------+---------------+-----------------+----------+-----------+
3 rows in set (0.00 sec)

mysql> select * from animals where name <> "Gabumon";
+----+---------+---------------+-----------------+----------+-----------+
| id | name    | date_of_birth | escape_attempts | neutered | weight_kg |
+----+---------+---------------+-----------------+----------+-----------+
|  1 | Agumon  | 2020-02-03    |               0 |        1 |     10.23 |
|  3 | Pikachu | 2021-01-07    |               1 |        0 |     15.04 |
|  4 | Devimon | 2017-05-12    |               5 |        1 |     11.00 |
+----+---------+---------------+-----------------+----------+-----------+
3 rows in set (0.00 sec)

mysql> select * from animals where weight_kg >= 10.4 and weight_kg <= 17.3;
+----+---------+---------------+-----------------+----------+-----------+
| id | name    | date_of_birth | escape_attempts | neutered | weight_kg |
+----+---------+---------------+-----------------+----------+-----------+
|  3 | Pikachu | 2021-01-07    |               1 |        0 |     15.04 |
|  4 | Devimon | 2017-05-12    |               5 |        1 |     11.00 |
+----+---------+---------------+-----------------+----------+-----------+
2 rows in set (0.00 sec)

mysql> use vet_clinic;
Database changed
mysql> set autocommit = 0;select * from animals;UPDATE ANIMALS SET species = 'unspecified';select * from animals;ROLLBACK;select * from animals;
Query OK, 0 rows affected (0.00 sec)

+----+------------+---------------+-----------------+----------+-----------+---------+
| id | name       | date_of_birth | escape_attempts | neutered | weight_kg | species |
+----+------------+---------------+-----------------+----------+-----------+---------+
|  1 | Agumon     | 2020-02-03    |               0 |        1 |     10.23 |         |
|  2 | Gabumon    | 2018-11-15    |               2 |        1 |      8.00 |         |
|  3 | Pikachu    | 2021-01-07    |               1 |        0 |     15.04 |         |
|  4 | Devimon    | 2017-05-12    |               5 |        1 |     11.00 |         |
|  5 | Charmander | 2020-02-08    |               0 |        1 |     11.00 |         |
|  6 | Plantmon   | 2021-11-15    |               2 |        1 |      5.70 |         |
|  7 | Squirtle   | 1993-04-02    |               3 |        0 |     12.13 |         |
|  8 | Angemon    | 2005-06-12    |               3 |        1 |     45.00 |         |
|  9 | Boarmon    | 2005-06-07    |               7 |        1 |     20.40 |         |
| 10 | Blossom    | 1998-10-13    |               3 |        1 |     17.00 |         |
| 11 | Ditto      | 2022-05-14    |               4 |        1 |     22.00 |         |
+----+------------+---------------+-----------------+----------+-----------+---------+
11 rows in set (0.00 sec)

Query OK, 11 rows affected (0.00 sec)
Rows matched: 11  Changed: 11  Warnings: 0

+----+------------+---------------+-----------------+----------+-----------+-------------+
| id | name       | date_of_birth | escape_attempts | neutered | weight_kg | species     |
+----+------------+---------------+-----------------+----------+-----------+-------------+
|  1 | Agumon     | 2020-02-03    |               0 |        1 |     10.23 | unspecified |
|  2 | Gabumon    | 2018-11-15    |               2 |        1 |      8.00 | unspecified |
|  3 | Pikachu    | 2021-01-07    |               1 |        0 |     15.04 | unspecified |
|  4 | Devimon    | 2017-05-12    |               5 |        1 |     11.00 | unspecified |
|  5 | Charmander | 2020-02-08    |               0 |        1 |     11.00 | unspecified |
|  6 | Plantmon   | 2021-11-15    |               2 |        1 |      5.70 | unspecified |
|  7 | Squirtle   | 1993-04-02    |               3 |        0 |     12.13 | unspecified |
|  8 | Angemon    | 2005-06-12    |               3 |        1 |     45.00 | unspecified |
|  9 | Boarmon    | 2005-06-07    |               7 |        1 |     20.40 | unspecified |
| 10 | Blossom    | 1998-10-13    |               3 |        1 |     17.00 | unspecified |
| 11 | Ditto      | 2022-05-14    |               4 |        1 |     22.00 | unspecified |
+----+------------+---------------+-----------------+----------+-----------+-------------+
11 rows in set (0.00 sec)

Query OK, 0 rows affected (0.00 sec)

+----+------------+---------------+-----------------+----------+-----------+---------+
| id | name       | date_of_birth | escape_attempts | neutered | weight_kg | species |
+----+------------+---------------+-----------------+----------+-----------+---------+
|  1 | Agumon     | 2020-02-03    |               0 |        1 |     10.23 |         |
|  2 | Gabumon    | 2018-11-15    |               2 |        1 |      8.00 |         |
|  3 | Pikachu    | 2021-01-07    |               1 |        0 |     15.04 |         |
|  4 | Devimon    | 2017-05-12    |               5 |        1 |     11.00 |         |
|  5 | Charmander | 2020-02-08    |               0 |        1 |     11.00 |         |
|  6 | Plantmon   | 2021-11-15    |               2 |        1 |      5.70 |         |
|  7 | Squirtle   | 1993-04-02    |               3 |        0 |     12.13 |         |
|  8 | Angemon    | 2005-06-12    |               3 |        1 |     45.00 |         |
|  9 | Boarmon    | 2005-06-07    |               7 |        1 |     20.40 |         |
| 10 | Blossom    | 1998-10-13    |               3 |        1 |     17.00 |         |
| 11 | Ditto      | 2022-05-14    |               4 |        1 |     22.00 |         |
+----+------------+---------------+-----------------+----------+-----------+---------+
11 rows in set (0.00 sec)

mysql> select * from animals; update animals set species ='digimon' where name like '%mon'; select * from animals;  update animals set species ='pokemon' where species = ''; select * from animals; commit;select * from animals;rollback;select * from animals;
+----+------------+---------------+-----------------+----------+-----------+---------+
| id | name       | date_of_birth | escape_attempts | neutered | weight_kg | species |
+----+------------+---------------+-----------------+----------+-----------+---------+
|  1 | Agumon     | 2020-02-03    |               0 |        1 |     10.23 |         |
|  2 | Gabumon    | 2018-11-15    |               2 |        1 |      8.00 |         |
|  3 | Pikachu    | 2021-01-07    |               1 |        0 |     15.04 |         |
|  4 | Devimon    | 2017-05-12    |               5 |        1 |     11.00 |         |
|  5 | Charmander | 2020-02-08    |               0 |        1 |     11.00 |         |
|  6 | Plantmon   | 2021-11-15    |               2 |        1 |      5.70 |         |
|  7 | Squirtle   | 1993-04-02    |               3 |        0 |     12.13 |         |
|  8 | Angemon    | 2005-06-12    |               3 |        1 |     45.00 |         |
|  9 | Boarmon    | 2005-06-07    |               7 |        1 |     20.40 |         |
| 10 | Blossom    | 1998-10-13    |               3 |        1 |     17.00 |         |
| 11 | Ditto      | 2022-05-14    |               4 |        1 |     22.00 |         |
+----+------------+---------------+-----------------+----------+-----------+---------+
11 rows in set (0.00 sec)

Query OK, 6 rows affected (0.00 sec)
Rows matched: 6  Changed: 6  Warnings: 0

+----+------------+---------------+-----------------+----------+-----------+---------+
| id | name       | date_of_birth | escape_attempts | neutered | weight_kg | species |
+----+------------+---------------+-----------------+----------+-----------+---------+
|  1 | Agumon     | 2020-02-03    |               0 |        1 |     10.23 | digimon |
|  2 | Gabumon    | 2018-11-15    |               2 |        1 |      8.00 | digimon |
|  3 | Pikachu    | 2021-01-07    |               1 |        0 |     15.04 |         |
|  4 | Devimon    | 2017-05-12    |               5 |        1 |     11.00 | digimon |
|  5 | Charmander | 2020-02-08    |               0 |        1 |     11.00 |         |
|  6 | Plantmon   | 2021-11-15    |               2 |        1 |      5.70 | digimon |
|  7 | Squirtle   | 1993-04-02    |               3 |        0 |     12.13 |         |
|  8 | Angemon    | 2005-06-12    |               3 |        1 |     45.00 | digimon |
|  9 | Boarmon    | 2005-06-07    |               7 |        1 |     20.40 | digimon |
| 10 | Blossom    | 1998-10-13    |               3 |        1 |     17.00 |         |
| 11 | Ditto      | 2022-05-14    |               4 |        1 |     22.00 |         |
+----+------------+---------------+-----------------+----------+-----------+---------+
11 rows in set (0.00 sec)

Query OK, 5 rows affected (0.00 sec)
Rows matched: 5  Changed: 5  Warnings: 0

+----+------------+---------------+-----------------+----------+-----------+---------+
| id | name       | date_of_birth | escape_attempts | neutered | weight_kg | species |
+----+------------+---------------+-----------------+----------+-----------+---------+
|  1 | Agumon     | 2020-02-03    |               0 |        1 |     10.23 | digimon |
|  2 | Gabumon    | 2018-11-15    |               2 |        1 |      8.00 | digimon |
|  3 | Pikachu    | 2021-01-07    |               1 |        0 |     15.04 | pokemon |
|  4 | Devimon    | 2017-05-12    |               5 |        1 |     11.00 | digimon |
|  5 | Charmander | 2020-02-08    |               0 |        1 |     11.00 | pokemon |
|  6 | Plantmon   | 2021-11-15    |               2 |        1 |      5.70 | digimon |
|  7 | Squirtle   | 1993-04-02    |               3 |        0 |     12.13 | pokemon |
|  8 | Angemon    | 2005-06-12    |               3 |        1 |     45.00 | digimon |
|  9 | Boarmon    | 2005-06-07    |               7 |        1 |     20.40 | digimon |
| 10 | Blossom    | 1998-10-13    |               3 |        1 |     17.00 | pokemon |
| 11 | Ditto      | 2022-05-14    |               4 |        1 |     22.00 | pokemon |
+----+------------+---------------+-----------------+----------+-----------+---------+
11 rows in set (0.00 sec)

Query OK, 0 rows affected (0.00 sec)

+----+------------+---------------+-----------------+----------+-----------+---------+
| id | name       | date_of_birth | escape_attempts | neutered | weight_kg | species |
+----+------------+---------------+-----------------+----------+-----------+---------+
|  1 | Agumon     | 2020-02-03    |               0 |        1 |     10.23 | digimon |
|  2 | Gabumon    | 2018-11-15    |               2 |        1 |      8.00 | digimon |
|  3 | Pikachu    | 2021-01-07    |               1 |        0 |     15.04 | pokemon |
|  4 | Devimon    | 2017-05-12    |               5 |        1 |     11.00 | digimon |
|  5 | Charmander | 2020-02-08    |               0 |        1 |     11.00 | pokemon |
|  6 | Plantmon   | 2021-11-15    |               2 |        1 |      5.70 | digimon |
|  7 | Squirtle   | 1993-04-02    |               3 |        0 |     12.13 | pokemon |
|  8 | Angemon    | 2005-06-12    |               3 |        1 |     45.00 | digimon |
|  9 | Boarmon    | 2005-06-07    |               7 |        1 |     20.40 | digimon |
| 10 | Blossom    | 1998-10-13    |               3 |        1 |     17.00 | pokemon |
| 11 | Ditto      | 2022-05-14    |               4 |        1 |     22.00 | pokemon |
+----+------------+---------------+-----------------+----------+-----------+---------+
11 rows in set (0.00 sec)

Query OK, 0 rows affected (0.00 sec)

+----+------------+---------------+-----------------+----------+-----------+---------+
| id | name       | date_of_birth | escape_attempts | neutered | weight_kg | species |
+----+------------+---------------+-----------------+----------+-----------+---------+
|  1 | Agumon     | 2020-02-03    |               0 |        1 |     10.23 | digimon |
|  2 | Gabumon    | 2018-11-15    |               2 |        1 |      8.00 | digimon |
|  3 | Pikachu    | 2021-01-07    |               1 |        0 |     15.04 | pokemon |
|  4 | Devimon    | 2017-05-12    |               5 |        1 |     11.00 | digimon |
|  5 | Charmander | 2020-02-08    |               0 |        1 |     11.00 | pokemon |
|  6 | Plantmon   | 2021-11-15    |               2 |        1 |      5.70 | digimon |
|  7 | Squirtle   | 1993-04-02    |               3 |        0 |     12.13 | pokemon |
|  8 | Angemon    | 2005-06-12    |               3 |        1 |     45.00 | digimon |
|  9 | Boarmon    | 2005-06-07    |               7 |        1 |     20.40 | digimon |
| 10 | Blossom    | 1998-10-13    |               3 |        1 |     17.00 | pokemon |
| 11 | Ditto      | 2022-05-14    |               4 |        1 |     22.00 | pokemon |
+----+------------+---------------+-----------------+----------+-----------+---------+
11 rows in set (0.00 sec)
mysql> delete from animals;
Query OK, 11 rows affected (0.00 sec)

mysql> select * from animals;
Empty set (0.00 sec)

mysql> rollback;
Query OK, 0 rows affected (0.00 sec)

mysql> select * from animals;
+----+------------+---------------+-----------------+----------+-----------+---------+
| id | name       | date_of_birth | escape_attempts | neutered | weight_kg | species |
+----+------------+---------------+-----------------+----------+-----------+---------+
|  1 | Agumon     | 2020-02-03    |               0 |        1 |     10.23 | digimon |
|  2 | Gabumon    | 2018-11-15    |               2 |        1 |      8.00 | digimon |
|  3 | Pikachu    | 2021-01-07    |               1 |        0 |     15.04 | pokemon |
|  4 | Devimon    | 2017-05-12    |               5 |        1 |     11.00 | digimon |
|  5 | Charmander | 2020-02-08    |               0 |        1 |     11.00 | pokemon |
|  6 | Plantmon   | 2021-11-15    |               2 |        1 |      5.70 | digimon |
|  7 | Squirtle   | 1993-04-02    |               3 |        0 |     12.13 | pokemon |
|  8 | Angemon    | 2005-06-12    |               3 |        1 |     45.00 | digimon |
|  9 | Boarmon    | 2005-06-07    |               7 |        1 |     20.40 | digimon |
| 10 | Blossom    | 1998-10-13    |               3 |        1 |     17.00 | pokemon |
| 11 | Ditto      | 2022-05-14    |               4 |        1 |     22.00 | pokemon |
+----+------------+---------------+-----------------+----------+-----------+---------+
11 rows in set (0.00 sec)

mysql> delete from animals where date_of_birth > '2022-01-01';
Query OK, 1 row affected (0.00 sec)

mysql> savepoint one;
Query OK, 0 rows affected (0.00 sec)

mysql> update animals set weight_kg =  weight_kg*(-1);
Query OK, 10 rows affected (0.00 sec)
Rows matched: 10  Changed: 10  Warnings: 0

mysql> select * from animals;
+----+------------+---------------+-----------------+----------+-----------+---------+
| id | name       | date_of_birth | escape_attempts | neutered | weight_kg | species |
+----+------------+---------------+-----------------+----------+-----------+---------+
|  1 | Agumon     | 2020-02-03    |               0 |        1 |    -10.23 | digimon |
|  2 | Gabumon    | 2018-11-15    |               2 |        1 |     -8.00 | digimon |
|  3 | Pikachu    | 2021-01-07    |               1 |        0 |    -15.04 | pokemon |
|  4 | Devimon    | 2017-05-12    |               5 |        1 |    -11.00 | digimon |
|  5 | Charmander | 2020-02-08    |               0 |        1 |    -11.00 | pokemon |
|  6 | Plantmon   | 2021-11-15    |               2 |        1 |     -5.70 | digimon |
|  7 | Squirtle   | 1993-04-02    |               3 |        0 |    -12.13 | pokemon |
|  8 | Angemon    | 2005-06-12    |               3 |        1 |    -45.00 | digimon |
|  9 | Boarmon    | 2005-06-07    |               7 |        1 |    -20.40 | digimon |
| 10 | Blossom    | 1998-10-13    |               3 |        1 |    -17.00 | pokemon |
+----+------------+---------------+-----------------+----------+-----------+---------+
10 rows in set (0.00 sec)

mysql> rollback to one;
Query OK, 0 rows affected (0.00 sec)

mysql> select * from animals;
+----+------------+---------------+-----------------+----------+-----------+---------+
| id | name       | date_of_birth | escape_attempts | neutered | weight_kg | species |
+----+------------+---------------+-----------------+----------+-----------+---------+
|  1 | Agumon     | 2020-02-03    |               0 |        1 |     10.23 | digimon |
|  2 | Gabumon    | 2018-11-15    |               2 |        1 |      8.00 | digimon |
|  3 | Pikachu    | 2021-01-07    |               1 |        0 |     15.04 | pokemon |
|  4 | Devimon    | 2017-05-12    |               5 |        1 |     11.00 | digimon |
|  5 | Charmander | 2020-02-08    |               0 |        1 |     11.00 | pokemon |
|  6 | Plantmon   | 2021-11-15    |               2 |        1 |      5.70 | digimon |
|  7 | Squirtle   | 1993-04-02    |               3 |        0 |     12.13 | pokemon |
|  8 | Angemon    | 2005-06-12    |               3 |        1 |     45.00 | digimon |
|  9 | Boarmon    | 2005-06-07    |               7 |        1 |     20.40 | digimon |
| 10 | Blossom    | 1998-10-13    |               3 |        1 |     17.00 | pokemon |
+----+------------+---------------+-----------------+----------+-----------+---------+
10 rows in set (0.00 sec)

mysql> update animals  set weight_kg = weight_kg*(-1) where weight_kg<0;
Query OK, 0 rows affected (0.00 sec)
Rows matched: 0  Changed: 0  Warnings: 0

mysql> select * from animals;
+----+------------+---------------+-----------------+----------+-----------+---------+
| id | name       | date_of_birth | escape_attempts | neutered | weight_kg | species |
+----+------------+---------------+-----------------+----------+-----------+---------+
|  1 | Agumon     | 2020-02-03    |               0 |        1 |     10.23 | digimon |
|  2 | Gabumon    | 2018-11-15    |               2 |        1 |      8.00 | digimon |
|  3 | Pikachu    | 2021-01-07    |               1 |        0 |     15.04 | pokemon |
|  4 | Devimon    | 2017-05-12    |               5 |        1 |     11.00 | digimon |
|  5 | Charmander | 2020-02-08    |               0 |        1 |     11.00 | pokemon |
|  6 | Plantmon   | 2021-11-15    |               2 |        1 |      5.70 | digimon |
|  7 | Squirtle   | 1993-04-02    |               3 |        0 |     12.13 | pokemon |
|  8 | Angemon    | 2005-06-12    |               3 |        1 |     45.00 | digimon |
|  9 | Boarmon    | 2005-06-07    |               7 |        1 |     20.40 | digimon |
| 10 | Blossom    | 1998-10-13    |               3 |        1 |     17.00 | pokemon |
+----+------------+---------------+-----------------+----------+-----------+---------+
10 rows in set (0.00 sec)

mysql> commit;
Query OK, 0 rows affected (0.00 sec)

mysql> select count(*) from animals;
+----------+
| count(*) |
+----------+
|       10 |
+----------+
1 row in set (0.01 sec)

mysql> select count(*) from animals where escape_attempts=0;
+----------+
| count(*) |
+----------+
|        2 |
+----------+
1 row in set (0.00 sec)

mysql> select avg(weight_kg) from animals;
+----------------+
| avg(weight_kg) |
+----------------+
|      15.550000 |
+----------------+
1 row in set (0.00 sec)

mysql> select neutered,sum(escape_attempts) from animals group by neutered order by sum(escape_attempts) desc limit 1;
+----------+----------------------+
| neutered | sum(escape_attempts) |
+----------+----------------------+
|        1 |                   20 |
+----------+----------------------+
1 row in set (0.00 sec)

mysql> select species, min(weight_kg),max(weight_kg) from animals group by species ;
+---------+----------------+----------------+
| species | min(weight_kg) | max(weight_kg) |
+---------+----------------+----------------+
| digimon |           5.70 |          45.00 |
| pokemon |          11.00 |          17.00 |
+---------+----------------+----------------+
2 rows in set (0.00 sec)

mysql> select avg(escape_attempts) as average from animals where extract(year from date_of_birth) between 1990 and 2000  group by species;
+---------+
| average |
+---------+
|  3.0000 |
+---------+
1 row in set (0.00 sec)